uni_name,uni_link,uni_city,uni_country,lat,lng,map_address,scholarship_name,scholarship_link,degree_level,field_of_study,original_fee_gbp,scholarship_amount_gbp,after_scholarship_fee_gbp,cgpa_min,deadline,documents_required,international_email,whatsapp,phone,apply_steps,verified,has_separate_form
University of Oxford,https://www.ox.ac.uk,Oxford,UK,51.7520,-1.2577,"Wellington Square, Oxford OX1 2JD",Clarendon Scholarship,https://www.ox.ac.uk/admissions/graduate/applying-to-oxford,Masters,All Fields,28000,28000,0,3.7,2026-01-10,"Transcripts|IELTS 7.0+|SOP|2 References","graduate.admissions@admin.ox.ac.uk","",+44 1865 270000,"1.Apply for eligible Oxford Masters by course deadline (Dec 2025–Jan 2026)|2.No separate scholarship form (auto consideration)|3.Upload all transcripts + references|4.Confirm college choice|5.Wait for Clarendon decision Feb–Jun 2026",true,false
University of Cambridge,https://www.cam.ac.uk,Cambridge,UK,52.2053,0.1218,"The Old Schools, Trinity Ln, Cambridge CB2 1TN",Gates Cambridge Scholarship,https://www.gatescambridge.org/apply,Masters,All Fields,29000,29000,0,3.7,2026-01-03,"Transcripts|Research Proposal|3 References|IELTS 7.0+","grad.admissions@admin.cam.ac.uk","",+44 1223 337733,"1.Choose eligible full-time Masters course|2.Apply for admission + funding via Cambridge application portal|3.Complete Gates funding section|4.Upload research proposal + 3 references|5.Attend interview (if shortlisted)",true,true
Imperial College London,https://www.imperial.ac.uk,London,UK,51.4983,-0.1759,"South Kensington Campus, London SW7 2AZ","Imperial Global Excellence Scholarship (Masters)",https://www.imperial.ac.uk/study/fees-and-funding/scholarships-search/,Masters,Engineering & Science,35000,15000,20000,3.5,2026-03-31,"Transcripts|Personal Statement|CV|IELTS 6.5+","study@imperial.ac.uk","",+44 20 7594 7777,"1.Apply for an eligible taught Masters at Imperial|2.Meet offer conditions|3.Complete any faculty scholarship form (if required)|4.Submit statement highlighting academic excellence|5.Wait for scholarship email from Imperial",true,true
UCL,https://www.ucl.ac.uk,London,UK,51.5240,-0.1334,"Gower Street, London WC1E 6BT",UCL Global Masters Scholarship,https://www.ucl.ac.uk/scholarships/ucl-global-masters-scholarship,Masters,All Fields,32000,15000,17000,3.2,2026-05-07,"Transcripts|Personal Statement|Income Evidence|IELTS 6.5+","international@ucl.ac.uk","",+44 20 7679 2000,"1.Apply for the Masters course and receive an offer|2.Login to UCL Portico and navigate to 'Funding'|3.Apply for the Global Masters Scholarship|4.Upload income/eligibility proof|5.Submit before 7 May deadline",true,true
University of Edinburgh,https://www.ed.ac.uk,Edinburgh,UK,55.9445,-3.1892,"Old College, South Bridge, Edinburgh EH8 9YL",Edinburgh Global Masters Scholarship,https://www.ed.ac.uk/student-funding/postgraduate/international/global/masters,Masters,All Fields,28000,8000,20000,3.0,2026-06-01,"Transcripts|SOP|IELTS 6.5+|1–2 References","internationalstudents@ed.ac.uk","",+44 131 650 1000,"1.Apply for an eligible on-campus Masters|2.Accept conditional/firm offer|3.Complete online scholarship application in MyEd|4.Answer motivation and academic questions|5.Submit before stated June deadline",true,true
University of Manchester,https://www.manchester.ac.uk,Manchester,UK,53.4668,-2.2338,"Oxford Rd, Manchester M13 9PL",Manchester Global Futures Scholarship (Masters),https://www.manchester.ac.uk/study/masters/fees-and-funding/masters-scholarships/,Masters,All Fields,30000,8000,22000,3.3,2026-04-30,"Transcripts|Personal Statement|CV|IELTS 6.5+","international@manchester.ac.uk","",+44 161 306 6000,"1.Apply for eligible postgraduate taught course|2.Receive conditional/firm offer|3.Fill Global Futures scholarship form|4.Write short essay on impact and leadership|5.Submit before school-specific deadline",true,true
King's College London,https://www.kcl.ac.uk,London,UK,51.5115,-0.1160,"Strand, London WC2R 2LS",King’s International PGT Scholarship,https://www.kcl.ac.uk/study/funding/kings-international-scholarship,Masters,All Fields,29000,10000,19000,3.3,2026-06-30,"Transcripts|Personal Statement|Reference|IELTS 6.5+","international@kcl.ac.uk","",+44 20 7836 5454,"1.Apply for a taught Masters at King’s|2.Receive offer letter|3.Complete King’s International Scholarship application|4.Write motivation statement|5.Submit before 30 June 2026",true,true
University of Bristol,https://www.bristol.ac.uk,Bristol,UK,51.4566,-2.6041,"Tyndall Ave, Bristol BS8 1TH",Think Big Postgraduate Scholarship,https://www.bristol.ac.uk/international/fees-finance/scholarships/,Masters,All Fields,27000,13000,14000,3.0,2026-04-29,"Transcripts|SOP|2 References|IELTS 6.5+","international-office@bristol.ac.uk","+44 7458158625",+44 117 331 1333,"1.Apply for an eligible postgraduate programme|2.Get a UoB student ID|3.Complete Think Big scholarship form online|4.Answer questions on academic merit and goals|5.Submit by 29 April 2026",true,true
University of Glasgow,https://www.gla.ac.uk,Glasgow,UK,55.8721,-4.2890,"Gilmorehill, University Avenue, Glasgow G12 8QQ",Postgraduate Excellence Scholarship,https://www.gla.ac.uk/scholarships/universityofglasgowpostgraduateexcellencescholarship/,Masters,All Fields,26000,10000,16000,3.2,2026-05-31,"Transcripts|SOP|IELTS 6.5+","international@glasgow.ac.uk","",+44 141 330 2000,"1.Apply for eligible Masters|2.Receive conditional offer|3.Auto-considered based on academic merit|4.No separate long form needed|5.Check offer email for scholarship decision",true,false
University of Warwick,https://warwick.ac.uk,Coventry,UK,52.3809,-1.5616,"Coventry CV4 7AL",Warwick Chancellor’s International Scholarship (Taught),https://warwick.ac.uk/study/postgraduate/fees-and-funding/scholarships/chancellors-international-scholarships/,Masters,All Fields,28000,18000,10000,3.4,2026-03-15,"Transcripts|Research/Study Plan|References|IELTS 6.5+","io.support@warwick.ac.uk","",+44 24 7652 3523,"1.Apply for relevant postgraduate degree|2.Complete scholarship application in Warwick portal|3.Upload study/research plan|4.Add referee details|5.Submit before 15 March 2026",true,true
Durham University,https://www.dur.ac.uk,Durham,UK,54.7753,-1.5776,"Durham DH1 3LE",Durham International Scholarship (Masters),https://www.durham.ac.uk/study/scholarships/postgraduate/,Masters,All Fields,27500,10000,17500,3.0,2026-07-31,"Transcripts|Personal Statement|IELTS 6.5+","international.office@durham.ac.uk","",+44 191 334 2000,"1.Apply for an eligible Masters|2.Get offer|3.Complete online scholarship form|4.Write personal statement (why Durham)|5.Submit before 31 July 2026",true,true
University of Sheffield,https://www.sheffield.ac.uk,Sheffield,UK,53.3811,-1.4888,"Western Bank, Sheffield S10 2TN",International Postgraduate Taught Merit Scholarship,https://www.sheffield.ac.uk/international/fees-and-funding/scholarships/postgraduate,Masters,All Fields,25000,3000,22000,3.0,2026-05-31,"Transcripts|IELTS 6.5+|Personal Statement","international@sheffield.ac.uk","",+44 114 222 2000,"1.Apply for eligible taught Masters at Sheffield|2.Get offer|3.Receive scholarship invitation email|4.Complete merit scholarship application|5.Submit by 31 May 2026",true,true
University of Birmingham,https://www.birmingham.ac.uk,Birmingham,UK,52.4508,-1.9305,"Edgbaston, Birmingham B15 2TT",Global Masters Scholarship,https://www.birmingham.ac.uk/international/students/finance/scholarships/global-masters-scholarship.aspx,Masters,All Fields,26500,10000,16500,3.0,2026-06-30,"Transcripts|Personal Statement|IELTS 6.5+","international@contacts.bham.ac.uk","",+44 121 414 3344,"1.Apply for eligible Masters course|2.Accept offer|3.Check if your country is eligible|4.Fill Global Masters scholarship form|5.Submit by 30 June 2026",true,true
University of Leeds,https://www.leeds.ac.uk,Leeds,UK,53.8067,-1.5550,"Woodhouse, Leeds LS2 9JT",Leeds Masters Scholarships,https://www.leeds.ac.uk/masters-scholarships,Masters,All Fields,27000,10000,17000,3.2,2026-03-31,"Transcripts|SOP|2 References|IELTS 6.5+","international@leeds.ac.uk","",+44 113 243 1751,"1.Apply for eligible Masters at Leeds|2.Get student ID|3.Complete specific school scholarship form if required|4.Write short answers for motivation|5.Submit by 31 March 2026",true,true
University of Nottingham,https://www.nottingham.ac.uk,Nottingham,UK,52.9540,-1.1870,"University Park, Nottingham NG7 2RD",Developing Solutions Masters Scholarship,https://www.nottingham.ac.uk/studywithus/international-applicants/scholarships/developing-solutions-masters-scholarships.aspx,Masters,Development Studies,26000,12000,14000,3.0,2026-04-30,"Transcripts|SOP (development focus)|IELTS 6.5+","internationalstudents@nottingham.ac.uk","",+44 115 951 5151,"1.Apply for eligible Masters in development-related subjects|2.Receive offer|3.Complete Developing Solutions online application|4.Write essay on how you’ll solve problems in your home country|5.Submit by 30 April 2026",true,true
University of Southampton,https://www.southampton.ac.uk,Southampton,UK,50.9354,-1.3968,"University Rd, Southampton SO17 1BJ",Southampton Postgraduate Taught Excellence Scholarship,https://www.southampton.ac.uk/study/fees-funding/postgraduate-fees-and-funding/scholarships.page,Masters,All Fields,28500,22000,6500,3.5,2026-01-31,"Transcripts|CV|Research/Study Statement|IELTS 6.5+","international@southampton.ac.uk","",+44 23 8059 5000,"1.Apply for Masters and receive an offer|2.Meet academic excellence threshold|3.Complete any faculty-specific scholarship steps|4.Submit study statement if requested|5.Decisions communicated after 31 Jan 2026",true,true
Newcastle University,https://www.ncl.ac.uk,Newcastle,UK,54.9783,-1.6178,"Newcastle upon Tyne NE1 7RU",Newcastle Vice-Chancellor’s Excellence Scholarship (PGT),https://www.ncl.ac.uk/study/fees-funding/search-funding/,Masters,All Fields,25500,8000,17500,3.0,2026-06-30,"Transcripts|Personal Statement|IELTS 6.5+","international-office@ncl.ac.uk","",+44 191 208 6000,"1.Apply for eligible PGT course|2.Get offer|3.Find VC Excellence scholarship in funding search|4.Complete online application|5.Submit by 30 June 2026",true,true
University of York,https://www.york.ac.uk,York,UK,53.9470,-1.0532,"Heslington, York YO10 5DD",York Masters Global Excellence Scholarship,https://www.york.ac.uk/study/postgraduate-taught/fees-funding/scholarships/,Masters,All Fields,26000,10000,16000,3.0,2026-06-30,"Transcripts|SOP|IELTS 6.5+","international@york.ac.uk","",+44 1904 320000,"1.Apply for a taught Masters at York|2.Receive offer|3.Complete York Scholarship application|4.Answer academic excellence questions|5.Submit by 30 June 2026",true,true
Lancaster University,https://www.lancaster.ac.uk,Lancaster,UK,54.0104,-2.7946,"Bailrigg, Lancaster LA1 4YW",Lancaster Global Scholarship (Taught Masters),https://www.lancaster.ac.uk/study/postgraduate/postgraduate-funding/global-scholarship/,Masters,All Fields,27000,9000,18000,3.2,2026-05-31,"Transcripts|Personal Statement|IELTS 6.5+","international@lancaster.ac.uk","",+44 1524 65201,"1.Apply for eligible Masters at Lancaster|2.Get offer|3.Auto-considered based on academic merit|4.No long separate form|5.Check offer letter for scholarship value",true,false
University of Exeter,https://www.exeter.ac.uk,Exeter,UK,50.7369,-3.5339,"Stocker Rd, Exeter EX4 4PY",Exeter Global Excellence Scholarship,https://www.exeter.ac.uk/studying/funding/award/?id=4359,Masters,All Fields,26500,10000,16500,3.0,2026-03-31,"Transcripts|SOP|IELTS 6.5+","international@exeter.ac.uk","",+44 1392 661000,"1.Apply for eligible Masters|2.Get offer|3.Complete Global Excellence scholarship application|4.Write statement on excellence and ambition|5.Submit by 31 March 2026",true,true
Cardiff University,https://www.cardiff.ac.uk,Cardiff,UK,51.4816,-3.1791,"Cardiff CF10 3AT",Cardiff Vice-Chancellor’s International Scholarship,https://www.cardiff.ac.uk/study/international/fees-and-funding/scholarships,Masters,All Fields,25000,7000,18000,3.0,2026-07-31,"Transcripts|Personal Statement|IELTS 6.5+","international@cardiff.ac.uk","",+44 29 2087 4000,"1.Apply for relevant Masters at Cardiff|2.Receive offer|3.Find VC International Scholarship on Cardiff site|4.Complete online form|5.Submit before 31 July 2026",true,true
